{
  "schemaVersion": "cairnmap.preset.v1",
  "presetId": "road",
  "label": "CairnMap Road Structures",
  "version": "0.1.0",
  "nativePreset": true,
  "runtimeStatus": "active",
  "description": "CairnMap Road Structures preset extracted from OpenRIAMap RIA configuration.",
  "providedClasses": [
    "ROD"
  ],
  "providedSharedModules": [],
  "providedWorkflows": [
    "road-workflow"
  ],
  "dependencies": [
    "core-structures"
  ]
}
