{
  "schemaVersion": "cairnmap.preset.v1",
  "presetId": "teleport",
  "label": "CairnMap Teleport Points",
  "version": "0.1.0",
  "nativePreset": true,
  "runtimeStatus": "active",
  "description": "CairnMap Teleport Points preset extracted from OpenRIAMap RIA configuration.",
  "providedClasses": [
    "TPP"
  ],
  "providedSharedModules": [],
  "providedWorkflows": [
    "teleport-workflow"
  ],
  "dependencies": [
    "core-structures"
  ]
}
