{
  "schemaVersion": "cairnmap.preset.v1",
  "presetId": "trade",
  "label": "CairnMap Trade Points",
  "version": "0.1.0",
  "nativePreset": true,
  "runtimeStatus": "active",
  "description": "CairnMap Trade Points preset extracted from OpenRIAMap RIA configuration.",
  "providedClasses": [
    "TRP"
  ],
  "providedSharedModules": [],
  "providedWorkflows": [
    "trade-point-workflow"
  ],
  "dependencies": [
    "core-structures"
  ]
}
